{
  "advisories": [
    "安装与调用由消费者按宿主文档人工验证，不阻断候选发布"
  ],
  "blocked": false,
  "blockingReasons": [],
  "claimsStableSupport": false,
  "deliveryMode": "workbuddy_plugin",
  "familyId": "skill-family-audit",
  "fileCount": 980,
  "files": [
    ".codebuddy-plugin/plugin.json",
    "foundation/foundation-handoff.json",
    "foundation/foundation-pin.json",
    "foundation/profile-spi/foundation-profile-spi-projection.json",
    "foundation/profile-spi/node_modules/@pnpm/constants/lib/index.js",
    "foundation/profile-spi/node_modules/@pnpm/constants/package.json",
    "foundation/profile-spi/node_modules/@pnpm/crypto.hash/lib/index.js",
    "foundation/profile-spi/node_modules/@pnpm/crypto.hash/package.json",
    "foundation/profile-spi/node_modules/@pnpm/crypto.polyfill/lib/index.js",
    "foundation/profile-spi/node_modules/@pnpm/crypto.polyfill/package.json",
    "foundation/profile-spi/node_modules/@pnpm/dependency-path/lib/index.js",
    "foundation/profile-spi/node_modules/@pnpm/dependency-path/package.json",
    "foundation/profile-spi/node_modules/@pnpm/error/lib/index.js",
    "foundation/profile-spi/node_modules/@pnpm/error/package.json",
    "foundation/profile-spi/node_modules/@pnpm/git-utils/lib/index.js",
    "foundation/profile-spi/node_modules/@pnpm/git-utils/package.json",
    "foundation/profile-spi/node_modules/@pnpm/graceful-fs/lib/index.js",
    "foundation/profile-spi/node_modules/@pnpm/graceful-fs/package.json",
    "foundation/profile-spi/node_modules/@pnpm/lockfile.fs/lib/errors/LockfileBreakingChangeError.js",
    "foundation/profile-spi/node_modules/@pnpm/lockfile.fs/lib/errors/index.js",
    "foundation/profile-spi/node_modules/@pnpm/lockfile.fs/lib/existsWantedLockfile.js",
    "foundation/profile-spi/node_modules/@pnpm/lockfile.fs/lib/getLockfileImporterId.js",
    "foundation/profile-spi/node_modules/@pnpm/lockfile.fs/lib/gitBranchLockfile.js",
    "foundation/profile-spi/node_modules/@pnpm/lockfile.fs/lib/gitMergeFile.js",
    "foundation/profile-spi/node_modules/@pnpm/lockfile.fs/lib/index.js",
    "foundation/profile-spi/node_modules/@pnpm/lockfile.fs/lib/lockfileFormatConverters.js",
    "foundation/profile-spi/node_modules/@pnpm/lockfile.fs/lib/lockfileName.js",
    "foundation/profile-spi/node_modules/@pnpm/lockfile.fs/lib/logger.js",
    "foundation/profile-spi/node_modules/@pnpm/lockfile.fs/lib/read.js",
    "foundation/profile-spi/node_modules/@pnpm/lockfile.fs/lib/sortLockfileKeys.js",
    "foundation/profile-spi/node_modules/@pnpm/lockfile.fs/lib/write.js",
    "foundation/profile-spi/node_modules/@pnpm/lockfile.fs/package.json",
    "foundation/profile-spi/node_modules/@pnpm/lockfile.merger/lib/index.js",
    "foundation/profile-spi/node_modules/@pnpm/lockfile.merger/package.json",
    "foundation/profile-spi/node_modules/@pnpm/lockfile.types/lib/index.js",
    "foundation/profile-spi/node_modules/@pnpm/lockfile.types/lib/lockfileFileTypes.js",
    "foundation/profile-spi/node_modules/@pnpm/lockfile.types/package.json",
    "foundation/profile-spi/node_modules/@pnpm/lockfile.utils/lib/assertRegistryShapedResolution.js",
    "foundation/profile-spi/node_modules/@pnpm/lockfile.utils/lib/index.js",
    "foundation/profile-spi/node_modules/@pnpm/lockfile.utils/lib/nameVerFromPkgSnapshot.js",
    "foundation/profile-spi/node_modules/@pnpm/lockfile.utils/lib/packageIdFromSnapshot.js",
    "foundation/profile-spi/node_modules/@pnpm/lockfile.utils/lib/packageIsIndependent.js",
    "foundation/profile-spi/node_modules/@pnpm/lockfile.utils/lib/pkgSnapshotToResolution.js",
    "foundation/profile-spi/node_modules/@pnpm/lockfile.utils/lib/refIsLocalTarball.js",
    "foundation/profile-spi/node_modules/@pnpm/lockfile.utils/package.json",
    "foundation/profile-spi/node_modules/@pnpm/logger/lib/index.js",
    "foundation/profile-spi/node_modules/@pnpm/logger/lib/logger.js",
    "foundation/profile-spi/node_modules/@pnpm/logger/lib/ndjsonParse.js",
    "foundation/profile-spi/node_modules/@pnpm/logger/lib/streamParser.js",
    "foundation/profile-spi/node_modules/@pnpm/logger/lib/writeToConsole.js",
    "foundation/profile-spi/node_modules/@pnpm/logger/package.json",
    "foundation/profile-spi/node_modules/@pnpm/object.key-sorting/lib/index.js",
    "foundation/profile-spi/node_modules/@pnpm/object.key-sorting/package.json",
    "foundation/profile-spi/node_modules/@pnpm/types/lib/config.js",
    "foundation/profile-spi/node_modules/@pnpm/types/lib/env.js",
    "foundation/profile-spi/node_modules/@pnpm/types/lib/index.js",
    "foundation/profile-spi/node_modules/@pnpm/types/lib/misc.js",
    "foundation/profile-spi/node_modules/@pnpm/types/lib/options.js",
    "foundation/profile-spi/node_modules/@pnpm/types/lib/package.js",
    "foundation/profile-spi/node_modules/@pnpm/types/lib/peerDependencyIssues.js",
    "foundation/profile-spi/node_modules/@pnpm/types/lib/project.js",
    "foundation/profile-spi/node_modules/@pnpm/types/package.json",
    "foundation/profile-spi/node_modules/@pnpm/util.lex-comparator/dist/index.js",
    "foundation/profile-spi/node_modules/@pnpm/util.lex-comparator/dist/lex-comparator.js",
    "foundation/profile-spi/node_modules/@pnpm/util.lex-comparator/package.json",
    "foundation/profile-spi/node_modules/@zkochan/rimraf/index.js",
    "foundation/profile-spi/node_modules/@zkochan/rimraf/package.json",
    "foundation/profile-spi/node_modules/@zkochan/which/package.json",
    "foundation/profile-spi/node_modules/@zkochan/which/which.js",
    "foundation/profile-spi/node_modules/ajv/dist/2020.js",
    "foundation/profile-spi/node_modules/ajv/dist/ajv.js",
    "foundation/profile-spi/node_modules/ajv/dist/compile/codegen/code.js",
    "foundation/profile-spi/node_modules/ajv/dist/compile/codegen/index.js",
    "foundation/profile-spi/node_modules/ajv/dist/compile/codegen/scope.js",
    "foundation/profile-spi/node_modules/ajv/dist/compile/errors.js",
    "foundation/profile-spi/node_modules/ajv/dist/compile/index.js",
    "foundation/profile-spi/node_modules/ajv/dist/compile/names.js",
    "foundation/profile-spi/node_modules/ajv/dist/compile/ref_error.js",
    "foundation/profile-spi/node_modules/ajv/dist/compile/resolve.js",
    "foundation/profile-spi/node_modules/ajv/dist/compile/rules.js",
    "foundation/profile-spi/node_modules/ajv/dist/compile/util.js",
    "foundation/profile-spi/node_modules/ajv/dist/compile/validate/applicability.js",
    "foundation/profile-spi/node_modules/ajv/dist/compile/validate/boolSchema.js",
    "foundation/profile-spi/node_modules/ajv/dist/compile/validate/dataType.js",
    "foundation/profile-spi/node_modules/ajv/dist/compile/validate/defaults.js",
    "foundation/profile-spi/node_modules/ajv/dist/compile/validate/index.js",
    "foundation/profile-spi/node_modules/ajv/dist/compile/validate/keyword.js",
    "foundation/profile-spi/node_modules/ajv/dist/compile/validate/subschema.js",
    "foundation/profile-spi/node_modules/ajv/dist/core.js",
    "foundation/profile-spi/node_modules/ajv/dist/refs/data.json",
    "foundation/profile-spi/node_modules/ajv/dist/refs/json-schema-2020-12/index.js",
    "foundation/profile-spi/node_modules/ajv/dist/refs/json-schema-2020-12/meta/applicator.json",
    "foundation/profile-spi/node_modules/ajv/dist/refs/json-schema-2020-12/meta/content.json",
    "foundation/profile-spi/node_modules/ajv/dist/refs/json-schema-2020-12/meta/core.json",
    "foundation/profile-spi/node_modules/ajv/dist/refs/json-schema-2020-12/meta/format-annotation.json",
    "foundation/profile-spi/node_modules/ajv/dist/refs/json-schema-2020-12/meta/meta-data.json",
    "foundation/profile-spi/node_modules/ajv/dist/refs/json-schema-2020-12/meta/unevaluated.json",
    "foundation/profile-spi/node_modules/ajv/dist/refs/json-schema-2020-12/meta/validation.json",
    "foundation/profile-spi/node_modules/ajv/dist/refs/json-schema-2020-12/schema.json",
    "foundation/profile-spi/node_modules/ajv/dist/refs/json-schema-draft-07.json",
    "foundation/profile-spi/node_modules/ajv/dist/runtime/equal.js",
    "foundation/profile-spi/node_modules/ajv/dist/runtime/ucs2length.js",
    "foundation/profile-spi/node_modules/ajv/dist/runtime/uri.js",
    "foundation/profile-spi/node_modules/ajv/dist/runtime/validation_error.js",
    "foundation/profile-spi/node_modules/ajv/dist/vocabularies/applicator/additionalItems.js",
    "foundation/profile-spi/node_modules/ajv/dist/vocabularies/applicator/additionalProperties.js",
    "foundation/profile-spi/node_modules/ajv/dist/vocabularies/applicator/allOf.js",
    "foundation/profile-spi/node_modules/ajv/dist/vocabularies/applicator/anyOf.js",
    "foundation/profile-spi/node_modules/ajv/dist/vocabularies/applicator/contains.js",
    "foundation/profile-spi/node_modules/ajv/dist/vocabularies/applicator/dependencies.js",
    "foundation/profile-spi/node_modules/ajv/dist/vocabularies/applicator/dependentSchemas.js",
    "foundation/profile-spi/node_modules/ajv/dist/vocabularies/applicator/if.js",
    "foundation/profile-spi/node_modules/ajv/dist/vocabularies/applicator/index.js",
    "foundation/profile-spi/node_modules/ajv/dist/vocabularies/applicator/items.js",
    "foundation/profile-spi/node_modules/ajv/dist/vocabularies/applicator/items2020.js",
    "foundation/profile-spi/node_modules/ajv/dist/vocabularies/applicator/not.js",
    "foundation/profile-spi/node_modules/ajv/dist/vocabularies/applicator/oneOf.js",
    "foundation/profile-spi/node_modules/ajv/dist/vocabularies/applicator/patternProperties.js",
    "foundation/profile-spi/node_modules/ajv/dist/vocabularies/applicator/prefixItems.js",
    "foundation/profile-spi/node_modules/ajv/dist/vocabularies/applicator/properties.js",
    "foundation/profile-spi/node_modules/ajv/dist/vocabularies/applicator/propertyNames.js",
    "foundation/profile-spi/node_modules/ajv/dist/vocabularies/applicator/thenElse.js",
    "foundation/profile-spi/node_modules/ajv/dist/vocabularies/code.js",